{
  "schema": "accelerator-perf-v1",
  "build_id": "dryrun-local",
  "device_alias": "bench-sim",
  "generated_at_utc": "2026-10-23T00:00:00Z",
  "protocol": {
    "min_samples": 10,
    "iqr_method": "linear-interpolation-on-sorted-values",
    "speedup_threshold": 1.5,
    "regression_permille": 50
  },
  "scenarios": [
    {
      "scenario": "cold_start",
      "mode": "QEMU_ONLY",
      "n": 10,
      "failures": 0,
      "failure_codes": {},
      "insufficient_samples": false,
      "median_ms": 4235.0,
      "iqr_ms": 55.0,
      "min_ms": 4180,
      "max_ms": 4300,
      "phases_ms": {
        "preprocess": 253.5,
        "transfer": 0.0,
        "compile": 3770.0,
        "link": 211.5
      },
      "offload_permille": 0,
      "retries": 0,
      "fallbacks": 0,
      "peak_kb": 524288
    },
    {
      "scenario": "cold_start",
      "mode": "QEMU_PLUS_ACCEL",
      "n": 10,
      "failures": 0,
      "failure_codes": {},
      "insufficient_samples": false,
      "median_ms": 3340.0,
      "iqr_ms": 35.0,
      "min_ms": 3290,
      "max_ms": 3380,
      "phases_ms": {
        "preprocess": 200.0,
        "transfer": 300.0,
        "compile": 2673.0,
        "link": 167.0
      },
      "offload_permille": 780,
      "retries": 0,
      "fallbacks": 0,
      "peak_kb": 524288
    },
    {
      "scenario": "small_project",
      "mode": "QEMU_ONLY",
      "n": 10,
      "failures": 1,
      "failure_codes": {
        "TIMEOUT": 1
      },
      "insufficient_samples": false,
      "median_ms": 2115.0,
      "iqr_ms": 36.25,
      "min_ms": 2080,
      "max_ms": 2160,
      "phases_ms": {
        "preprocess": 126.5,
        "transfer": 0.0,
        "compile": 1883.0,
        "link": 105.5
      },
      "offload_permille": 0,
      "retries": 0,
      "fallbacks": 1,
      "peak_kb": 524288
    },
    {
      "scenario": "small_project",
      "mode": "QEMU_PLUS_ACCEL",
      "n": 10,
      "failures": 1,
      "failure_codes": {
        "DISTCC_FALLBACK": 1
      },
      "insufficient_samples": false,
      "median_ms": 1312.5,
      "iqr_ms": 26.25,
      "min_ms": 1280,
      "max_ms": 1350,
      "phases_ms": {
        "preprocess": 78.0,
        "transfer": 117.5,
        "compile": 1052.0,
        "link": 65.0
      },
      "offload_permille": 860,
      "retries": 0,
      "fallbacks": 2,
      "peak_kb": 524288
    },
    {
      "scenario": "medium_project_j1",
      "mode": "QEMU_ONLY",
      "n": 10,
      "failures": 0,
      "failure_codes": {},
      "insufficient_samples": false,
      "median_ms": 9825.0,
      "iqr_ms": 52.5,
      "min_ms": 9750,
      "max_ms": 9900,
      "phases_ms": {
        "preprocess": 589.0,
        "transfer": 0.0,
        "compile": 8745.0,
        "link": 491.0
      },
      "offload_permille": 0,
      "retries": 0,
      "fallbacks": 0,
      "peak_kb": 524288
    },
    {
      "scenario": "medium_project_j1",
      "mode": "QEMU_PLUS_ACCEL",
      "n": 10,
      "failures": 0,
      "failure_codes": {},
      "insufficient_samples": false,
      "median_ms": 8925.0,
      "iqr_ms": 52.5,
      "min_ms": 8850,
      "max_ms": 9020,
      "phases_ms": {
        "preprocess": 535.0,
        "transfer": 802.5,
        "compile": 7141.5,
        "link": 446.0
      },
      "offload_permille": 860,
      "retries": 0,
      "fallbacks": 0,
      "peak_kb": 524288
    },
    {
      "scenario": "medium_project_j2",
      "mode": "QEMU_ONLY",
      "n": 10,
      "failures": 0,
      "failure_codes": {},
      "insufficient_samples": false,
      "median_ms": 7625.0,
      "iqr_ms": 45.0,
      "min_ms": 7580,
      "max_ms": 7700,
      "phases_ms": {
        "preprocess": 457.0,
        "transfer": 0.0,
        "compile": 6787.0,
        "link": 381.0
      },
      "offload_permille": 0,
      "retries": 0,
      "fallbacks": 0,
      "peak_kb": 524288
    },
    {
      "scenario": "medium_project_j2",
      "mode": "QEMU_PLUS_ACCEL",
      "n": 10,
      "failures": 0,
      "failure_codes": {},
      "insufficient_samples": false,
      "median_ms": 4625.0,
      "iqr_ms": 45.0,
      "min_ms": 4580,
      "max_ms": 4700,
      "phases_ms": {
        "preprocess": 277.0,
        "transfer": 415.5,
        "compile": 3701.5,
        "link": 231.0
      },
      "offload_permille": 860,
      "retries": 0,
      "fallbacks": 0,
      "peak_kb": 524288
    },
    {
      "scenario": "medium_project_j4",
      "mode": "QEMU_ONLY",
      "n": 10,
      "failures": 0,
      "failure_codes": {},
      "insufficient_samples": false,
      "median_ms": 6225.0,
      "iqr_ms": 45.0,
      "min_ms": 6180,
      "max_ms": 6300,
      "phases_ms": {
        "preprocess": 373.0,
        "transfer": 0.0,
        "compile": 5541.0,
        "link": 311.0
      },
      "offload_permille": 0,
      "retries": 0,
      "fallbacks": 0,
      "peak_kb": 524288
    },
    {
      "scenario": "medium_project_j4",
      "mode": "QEMU_PLUS_ACCEL",
      "n": 10,
      "failures": 1,
      "failure_codes": {
        "THERMAL_BUDGET": 1
      },
      "insufficient_samples": false,
      "median_ms": 3925.0,
      "iqr_ms": 45.0,
      "min_ms": 3880,
      "max_ms": 4000,
      "phases_ms": {
        "preprocess": 235.0,
        "transfer": 352.5,
        "compile": 3141.5,
        "link": 196.0
      },
      "offload_permille": 860,
      "retries": 0,
      "fallbacks": 1,
      "peak_kb": 524288
    }
  ]
}
